mail,password,username,first_name,last_name,country,description,profile_picture
evannavarro92@example.com,yg$pjPGoiJ0c,evannavarro92,Evan,Navarro,Belgium,Arrive forget statement second hard everything.,https://i.pravatar.cc/150?u=evannavarro92@example.com
jacquelinenelson1@example.com,$mPU7S8n!wy2,jacquelinenelson1,Jacqueline,Nelson,Uganda,Rock pull shake summer check discover unit government suggest ever.,https://i.pravatar.cc/150?u=jacquelinenelson1@example.com
darrylgentry62@example.com,uKYB43HcMGc*,darrylgentry62,Darryl,Gentry,Philippines,Decide inside but room foreign that particularly sign how interesting threat.,https://i.pravatar.cc/150?u=darrylgentry62@example.com
gregstanley36@example.com,#FaJF@Ig4dvM,gregstanley36,Greg,Stanley,Nauru,Hotel including exactly about them add according sound send simple develop southern statement.,https://i.pravatar.cc/150?u=gregstanley36@example.com
davidwalker59@example.com,$0o^mix91xlT,davidwalker59,David,Walker,Central African Republic,Lawyer yeah direction institution second poor.,https://i.pravatar.cc/150?u=davidwalker59@example.com
stephaniehanson27@example.com,+Z6KaUeY#E6Z,stephaniehanson27,Stephanie,Hanson,Lao People's Democratic Republic,Production do Mr throughout ground none fish.,https://i.pravatar.cc/150?u=stephaniehanson27@example.com
rebeccajensen38@example.com,#*I*npsVl3yF,rebeccajensen38,Rebecca,Jensen,Nauru,Impact ever design coach kid let talk maintain however.,https://i.pravatar.cc/150?u=rebeccajensen38@example.com
katherineforbes26@example.com,@RDgTMirX06O,katherineforbes26,Katherine,Forbes,Congo,Center assume television conference less until environmental so product door.,https://i.pravatar.cc/150?u=katherineforbes26@example.com
rebeccaburke7@example.com,W$0g3YGz!sL3,rebeccaburke7,Rebecca,Burke,India,Shoulder necessary must morning force believe my capital before prepare list.,https://i.pravatar.cc/150?u=rebeccaburke7@example.com
jessehurst55@example.com,^w+3HWxFCK2+,jessehurst55,Jesse,Hurst,American Samoa,Standard sound industry always front same strategy how theory.,https://i.pravatar.cc/150?u=jessehurst55@example.com
chadcummings29@example.com,+SYnLzM@r6_Y,chadcummings29,Chad,Cummings,Iran,Community threat evidence develop customer collection coach risk behind play store make.,https://i.pravatar.cc/150?u=chadcummings29@example.com
laurenpowell56@example.com,$5RPGgvda$gL,laurenpowell56,Lauren,Powell,Niue,Staff able natural article wrong hour person coach.,https://i.pravatar.cc/150?u=laurenpowell56@example.com
christianfry87@example.com,SAz_l7Zi^%Tf,christianfry87,Christian,Fry,Dominican Republic,Wall role effort radio front daughter.,https://i.pravatar.cc/150?u=christianfry87@example.com
michaelluna32@example.com,sTK6Xvy_#leA,michaelluna32,Michael,Luna,Bulgaria,Standard dream employee thing actually radio former attack process.,https://i.pravatar.cc/150?u=michaelluna32@example.com
davidblake16@example.com,4pX3UpiM&PD&,davidblake16,David,Blake,United States of America,Top hour chair language ball approach power crime garden.,https://i.pravatar.cc/150?u=davidblake16@example.com
jeffreycurtis58@example.com,IEJJl3Oc!^xs,jeffreycurtis58,Jeffrey,Curtis,Turkey,Property camera apply sister article food policy tough yet community.,https://i.pravatar.cc/150?u=jeffreycurtis58@example.com
stanleyarnold56@example.com,(dV(qZKx*6b%,stanleyarnold56,Stanley,Arnold,Albania,Beautiful a quickly low soldier factor month body prevent simple enter.,https://i.pravatar.cc/150?u=stanleyarnold56@example.com
sheilasnow49@example.com,vi(1BxrfxhNj,sheilasnow49,Sheila,Snow,Mali,Arm democratic conference challenge radio model.,https://i.pravatar.cc/150?u=sheilasnow49@example.com
maryjohnson60@example.com,m5RV6!ci71z^,maryjohnson60,Mary,Johnson,North Macedonia,Factor air year return teacher involve on bank pressure main allow rise.,https://i.pravatar.cc/150?u=maryjohnson60@example.com
robertlyons10@example.com,v)%_8MjJYC!v,robertlyons10,Robert,Lyons,Qatar,Off win sit building about large you until thousand necessary.,https://i.pravatar.cc/150?u=robertlyons10@example.com
jenniferwilliams24@example.com,@ud7H8mtBG6v,jenniferwilliams24,Jennifer,Williams,Mozambique,Daughter make maintain society catch later lay.,https://i.pravatar.cc/150?u=jenniferwilliams24@example.com
ryanstewart86@example.com,b_*z0DRj8RDD,ryanstewart86,Ryan,Stewart,Mayotte,Nothing majority foot head assume use.,https://i.pravatar.cc/150?u=ryanstewart86@example.com
anthonyhernandez55@example.com,0YXvbSY_#BCa,anthonyhernandez55,Anthony,Hernandez,Andorra,Author above free discuss per each find hot several suffer.,https://i.pravatar.cc/150?u=anthonyhernandez55@example.com
michaelmoore70@example.com,0#_H9aRf^xSo,michaelmoore70,Michael,Moore,Guam,Skin turn floor party idea final form age.,https://i.pravatar.cc/150?u=michaelmoore70@example.com
michaelsmith61@example.com,R&t2W1w4+iaK,michaelsmith61,Michael,Smith,Trinidad and Tobago,Mrs accept stop now feeling prepare create develop author.,https://i.pravatar.cc/150?u=michaelsmith61@example.com
karenpeterson47@example.com,$QwEsvtRSD1O,karenpeterson47,Karen,Peterson,United States Minor Outlying Islands,Dog anything ago enjoy nor during trade.,https://i.pravatar.cc/150?u=karenpeterson47@example.com
josephtaylor85@example.com,%&6%#k#!s8Lk,josephtaylor85,Joseph,Taylor,Korea,More themselves address camera president seem future teacher yes mind process.,https://i.pravatar.cc/150?u=josephtaylor85@example.com
chrisclay93@example.com,wrDb5Ko^C^3C,chrisclay93,Chris,Clay,Cote d'Ivoire,Store according professor parent hotel partner approach mission.,https://i.pravatar.cc/150?u=chrisclay93@example.com
timothymccormick51@example.com,0+gXHumOhm9@,timothymccormick51,Timothy,Mccormick,Spain,Score large respond this pattern energy small total yourself kind detail better authority.,https://i.pravatar.cc/150?u=timothymccormick51@example.com
toddgonzalez73@example.com,eeXJnUqE*1V$,toddgonzalez73,Todd,Gonzalez,Japan,Toward but weight accept huge development way nation.,https://i.pravatar.cc/150?u=toddgonzalez73@example.com
tinabarnes76@example.com,b)%jg9Cg9go0,tinabarnes76,Tina,Barnes,Mali,Method almost heavy sign six cold evidence office.,https://i.pravatar.cc/150?u=tinabarnes76@example.com
kennethsnyder51@example.com,(mkPCMogf52M,kennethsnyder51,Kenneth,Snyder,United States Minor Outlying Islands,Under all out degree discussion energy eat be.,https://i.pravatar.cc/150?u=kennethsnyder51@example.com
michealwood32@example.com,%cnPMCme64k(,michealwood32,Micheal,Wood,San Marino,Write man exist prevent focus industry federal hand simple full.,https://i.pravatar.cc/150?u=michealwood32@example.com
denisewolf67@example.com,qwtnSiESH*2M,denisewolf67,Denise,Wolf,North Macedonia,Within society middle care everything help reason beat ground back indeed central also.,https://i.pravatar.cc/150?u=denisewolf67@example.com
caitlinoconnell34@example.com,1o1yWne2^AI5,caitlinoconnell34,Caitlin,Oconnell,Antarctica (the territory South of 60 deg S),Son example very industry sea owner do report.,https://i.pravatar.cc/150?u=caitlinoconnell34@example.com
matthewjennings41@example.com,%%S14(vNTG6Q,matthewjennings41,Matthew,Jennings,Gabon,Main bit also dark bad Congress my those third produce.,https://i.pravatar.cc/150?u=matthewjennings41@example.com
cynthiapatterson88@example.com,3b3$YIZHP&%_,cynthiapatterson88,Cynthia,Patterson,Czech Republic,Camera guess who single top all test recently same kind important particularly democratic.,https://i.pravatar.cc/150?u=cynthiapatterson88@example.com
stephaniemitchell90@example.com,WV3ICqya%0aC,stephaniemitchell90,Stephanie,Mitchell,Denmark,Single issue bit history already around now former late wall family morning use.,https://i.pravatar.cc/150?u=stephaniemitchell90@example.com
jaykane61@example.com,ZM3UYmcB6fV_,jaykane61,Jay,Kane,Oman,Such nearly plant call street surface again it particularly morning room traditional.,https://i.pravatar.cc/150?u=jaykane61@example.com
rhondasparks89@example.com,d+2+dueA9_7Y,rhondasparks89,Rhonda,Sparks,United States of America,About thousand perhaps cut citizen address.,https://i.pravatar.cc/150?u=rhondasparks89@example.com
jaimeweber37@example.com,F!EWREyd*0l_,jaimeweber37,Jaime,Weber,Congo,Tv really report would note house tough.,https://i.pravatar.cc/150?u=jaimeweber37@example.com
jessicadawson80@example.com,8%&A)_rd*RIr,jessicadawson80,Jessica,Dawson,Moldova,Least wonder lead right tend or.,https://i.pravatar.cc/150?u=jessicadawson80@example.com
nathanielreed93@example.com,@8@7JH7lNz6Z,nathanielreed93,Nathaniel,Reed,Haiti,Speak executive major property clear company range wait nature read care.,https://i.pravatar.cc/150?u=nathanielreed93@example.com
benjaminarcher64@example.com,aYWSQMtW_9(z,benjaminarcher64,Benjamin,Archer,United States Minor Outlying Islands,Above realize nice television garden article accept policy improve paper eye.,https://i.pravatar.cc/150?u=benjaminarcher64@example.com
adamfry33@example.com,%3Etfc3n_IB9,adamfry33,Adam,Fry,Nigeria,Control seek hotel name range guess chair who run wall.,https://i.pravatar.cc/150?u=adamfry33@example.com
michaelscott66@example.com,nl++o8XepiJ#,michaelscott66,Michael,Scott,Heard Island and McDonald Islands,Weight shoulder above as let hope thank thus book film go cold might.,https://i.pravatar.cc/150?u=michaelscott66@example.com
joshuasantos27@example.com,2+9$7fgF%4TB,joshuasantos27,Joshua,Santos,Czech Republic,Specific style majority skin every almost just attack business.,https://i.pravatar.cc/150?u=joshuasantos27@example.com
johnyates14@example.com,q2EmLTbTC)88,johnyates14,John,Yates,India,Fine risk little level authority third.,https://i.pravatar.cc/150?u=johnyates14@example.com
sharonlowe71@example.com,)0BKqjwo+2pQ,sharonlowe71,Sharon,Lowe,Libyan Arab Jamahiriya,Candidate year part million today teach business rest media within police.,https://i.pravatar.cc/150?u=sharonlowe71@example.com
tiffanylewis81@example.com,3lGtcIPr!EXx,tiffanylewis81,Tiffany,Lewis,Andorra,Sense remain than suggest one yeah have clear another nor moment student.,https://i.pravatar.cc/150?u=tiffanylewis81@example.com
gregoryblair23@example.com,172+%cld&WHh,gregoryblair23,Gregory,Blair,Saint Barthelemy,Quickly of quickly concern manager next.,https://i.pravatar.cc/150?u=gregoryblair23@example.com
paulmyers4@example.com,B9n&$Lxf%RsY,paulmyers4,Paul,Myers,New Zealand,Matter capital first dark theory another program type there notice top everybody.,https://i.pravatar.cc/150?u=paulmyers4@example.com
haroldcross26@example.com,R%S+g3M9dgGW,haroldcross26,Harold,Cross,Tuvalu,Garden education sea since a network decide lose pick couple political growth say.,https://i.pravatar.cc/150?u=haroldcross26@example.com
christopherhenry70@example.com,%i#bQzAsEC11,christopherhenry70,Christopher,Henry,Panama,Meet both mother training interview not less radio condition.,https://i.pravatar.cc/150?u=christopherhenry70@example.com
andrewbarron31@example.com,L%HVH37f2@3k,andrewbarron31,Andrew,Barron,Ireland,Can according short protect family high scientist.,https://i.pravatar.cc/150?u=andrewbarron31@example.com
terrirodriguez67@example.com,0Z#M$sl!#T71,terrirodriguez67,Terri,Rodriguez,Saint Helena,Best among as six door word.,https://i.pravatar.cc/150?u=terrirodriguez67@example.com
amandawright71@example.com,(H8m!vqor#E7,amandawright71,Amanda,Wright,Comoros,Call woman analysis last technology letter line paper either event left.,https://i.pravatar.cc/150?u=amandawright71@example.com
andrewbailey70@example.com,E$PK9uhbHB_1,andrewbailey70,Andrew,Bailey,Antarctica (the territory South of 60 deg S),End avoid animal true evening school her dog carry address.,https://i.pravatar.cc/150?u=andrewbailey70@example.com
zacharyleonard43@example.com,%4P&T4foF#pa,zacharyleonard43,Zachary,Leonard,Poland,Raise middle carry dream inside home peace stage idea.,https://i.pravatar.cc/150?u=zacharyleonard43@example.com
josetorres13@example.com,)5E@@6ggvCtI,josetorres13,Jose,Torres,Norway,Side store half drive write first alone.,https://i.pravatar.cc/150?u=josetorres13@example.com
jamesharris78@example.com,^oc@+e6y^8Ic,jamesharris78,James,Harris,Luxembourg,Like religious outside air believe citizen wide few appear early.,https://i.pravatar.cc/150?u=jamesharris78@example.com
denisegallagher37@example.com,%0vGEYWtUyVN,denisegallagher37,Denise,Gallagher,Cayman Islands,Hope pressure music leg us fall about wife give.,https://i.pravatar.cc/150?u=denisegallagher37@example.com
christophervargas3@example.com,$_7(6zcfRGI$,christophervargas3,Christopher,Vargas,Svalbard & Jan Mayen Islands,Popular tell onto suddenly big seem actually.,https://i.pravatar.cc/150?u=christophervargas3@example.com
ericasims73@example.com,Ggd6A3tad)1^,ericasims73,Erica,Sims,Albania,Find leg executive ok spring for cause fine message standard federal lot become.,https://i.pravatar.cc/150?u=ericasims73@example.com
kennethmcclain96@example.com,k@7hrasAVvN&,kennethmcclain96,Kenneth,Mcclain,Belgium,Section western bed provide character year oil less interview wish image none since.,https://i.pravatar.cc/150?u=kennethmcclain96@example.com
jeremyjones96@example.com,Q$8()n$&$8QL,jeremyjones96,Jeremy,Jones,Nauru,Heavy body above Republican affect participant wonder talk yourself happy gas democratic.,https://i.pravatar.cc/150?u=jeremyjones96@example.com
coltonmcdonald33@example.com,__a3Axii_8Ze,coltonmcdonald33,Colton,Mcdonald,Liberia,When analysis and industry direction all price bill.,https://i.pravatar.cc/150?u=coltonmcdonald33@example.com
bobbymyers24@example.com,k@_q58To4vY4,bobbymyers24,Bobby,Myers,Holy See (Vatican City State),Information reduce region soldier finish city point lot doctor picture allow.,https://i.pravatar.cc/150?u=bobbymyers24@example.com
caitlinwillis62@example.com,E&D(vGdF6h6K,caitlinwillis62,Caitlin,Willis,San Marino,Job may yes certainly true tell hair arrive.,https://i.pravatar.cc/150?u=caitlinwillis62@example.com
larrycharles83@example.com,n9LKF2Cs+Ms(,larrycharles83,Larry,Charles,Azerbaijan,Eight house quality money once read stock appear task building.,https://i.pravatar.cc/150?u=larrycharles83@example.com
maryharris95@example.com,+R!g8U6fuZMX,maryharris95,Mary,Harris,Antarctica (the territory South of 60 deg S),Western animal law serve western democratic American.,https://i.pravatar.cc/150?u=maryharris95@example.com
valeriesampson77@example.com,$(a_ZR!wSE&1,valeriesampson77,Valerie,Sampson,Cayman Islands,Explain learn after medical fill wind same employee.,https://i.pravatar.cc/150?u=valeriesampson77@example.com
melissajackson81@example.com,_#mI#Xzy03@U,melissajackson81,Melissa,Jackson,Isle of Man,Hand walk your director wind parent leave.,https://i.pravatar.cc/150?u=melissajackson81@example.com
lisakoch70@example.com,&CnDOJQyG1XX,lisakoch70,Lisa,Koch,India,Despite explain ball your box bed specific major remember table.,https://i.pravatar.cc/150?u=lisakoch70@example.com
lindsaygonzalez79@example.com,b2+JU1b((vtj,lindsaygonzalez79,Lindsay,Gonzalez,Germany,Dog far town they they wait culture couple.,https://i.pravatar.cc/150?u=lindsaygonzalez79@example.com
kimwalker36@example.com,&m+9!Phvze9T,kimwalker36,Kim,Walker,South Africa,Kid mean very nearly father rest finally since institution picture.,https://i.pravatar.cc/150?u=kimwalker36@example.com
ethanfletcher96@example.com,oiKUKQVU%19h,ethanfletcher96,Ethan,Fletcher,Honduras,Each table raise star direction possible.,https://i.pravatar.cc/150?u=ethanfletcher96@example.com
debbiemiller23@example.com,+B2LCCVf%7UP,debbiemiller23,Debbie,Miller,Iraq,Move serious across night energy personal always.,https://i.pravatar.cc/150?u=debbiemiller23@example.com
allisondavis31@example.com,N8%9MDbp@tOU,allisondavis31,Allison,Davis,Syrian Arab Republic,Soon place either hundred respond green million fine recently work enter.,https://i.pravatar.cc/150?u=allisondavis31@example.com
shariparker61@example.com,$UtSStt4t2zm,shariparker61,Shari,Parker,British Indian Ocean Territory (Chagos Archipelago),Join challenge site anything foot young morning face federal nature court receive recently go.,https://i.pravatar.cc/150?u=shariparker61@example.com
kevinwilliams37@example.com,H(2EbqGp^+3J,kevinwilliams37,Kevin,Williams,Mayotte,Blood space as subject step stop television this all rise require.,https://i.pravatar.cc/150?u=kevinwilliams37@example.com
daniellescott20@example.com,%YG4X1Ax4I4k,daniellescott20,Danielle,Scott,Belize,If above herself clear future safe central race single least.,https://i.pravatar.cc/150?u=daniellescott20@example.com
nicolefowler77@example.com,(7_i*fIpiYGS,nicolefowler77,Nicole,Fowler,Nigeria,Memory our wind because one eat mouth amount small fall hospital.,https://i.pravatar.cc/150?u=nicolefowler77@example.com
bethmason81@example.com,jnZJ2_IjfM+(,bethmason81,Beth,Mason,Belgium,Final easy economy across a rate according thus.,https://i.pravatar.cc/150?u=bethmason81@example.com
ivanwilson99@example.com,f&&59IuuiCgw,ivanwilson99,Ivan,Wilson,Thailand,Service few management computer crime prevent prevent special wall threat century next.,https://i.pravatar.cc/150?u=ivanwilson99@example.com
davidramsey72@example.com,RgK&l^sm)72R,davidramsey72,David,Ramsey,Suriname,Piece keep computer along I try.,https://i.pravatar.cc/150?u=davidramsey72@example.com
davidtaylor55@example.com,6m1Ti_SdZ@TD,davidtaylor55,David,Taylor,Kazakhstan,Need police most yourself without discover matter level fish.,https://i.pravatar.cc/150?u=davidtaylor55@example.com
josephnewman67@example.com,k_IS@Gtq+T4y,josephnewman67,Joseph,Newman,Romania,Short yeah leader attention total employee.,https://i.pravatar.cc/150?u=josephnewman67@example.com
valerielong14@example.com,weo4QZpQa)9p,valerielong14,Valerie,Long,United States Minor Outlying Islands,Which ability positive they dog attention hour bag expect number car.,https://i.pravatar.cc/150?u=valerielong14@example.com
allenlopez32@example.com,^9BXRm2zyivD,allenlopez32,Allen,Lopez,Antigua and Barbuda,Clearly rise respond wonder book dream.,https://i.pravatar.cc/150?u=allenlopez32@example.com
breannagomez69@example.com,*EDB^lJJP8dO,breannagomez69,Breanna,Gomez,Saint Barthelemy,Next commercial will expect lead address animal both.,https://i.pravatar.cc/150?u=breannagomez69@example.com
angelmoss26@example.com,bOlFCph7(3kO,angelmoss26,Angel,Moss,Belize,Strategy book degree voice whatever physical notice choice finish.,https://i.pravatar.cc/150?u=angelmoss26@example.com
stephanierogers39@example.com,Ho*9AtjhG^vE,stephanierogers39,Stephanie,Rogers,China,By health health black eight star recently we.,https://i.pravatar.cc/150?u=stephanierogers39@example.com
vickistewart67@example.com,n1NBXoui$9uB,vickistewart67,Vicki,Stewart,Eritrea,Down drop cell address city town manager.,https://i.pravatar.cc/150?u=vickistewart67@example.com
robertwalsh73@example.com,)L9h&ZhMgRKs,robertwalsh73,Robert,Walsh,Cuba,Response political necessary beautiful fire above husband.,https://i.pravatar.cc/150?u=robertwalsh73@example.com
christinehudson56@example.com,)IhXw^5245$b,christinehudson56,Christine,Hudson,Grenada,Significant policy authority else share out enough rest.,https://i.pravatar.cc/150?u=christinehudson56@example.com
michellenguyen78@example.com,#CUv4Ing)6zI,michellenguyen78,Michelle,Nguyen,Liberia,Suddenly finally memory whose party inside suffer team cut especially information.,https://i.pravatar.cc/150?u=michellenguyen78@example.com
robynblevins14@example.com,(SodXNfeL9Ed,robynblevins14,Robyn,Blevins,Belgium,Four either wrong time contain often great today news affect take sea.,https://i.pravatar.cc/150?u=robynblevins14@example.com
ginaclark55@example.com,b$n^nr2mZT5Z,ginaclark55,Gina,Clark,Mayotte,Current act deal before light break citizen almost it commercial plant.,https://i.pravatar.cc/150?u=ginaclark55@example.com
johnnewman37@example.com,_ZNtavWhOS5Q,johnnewman37,John,Newman,Guatemala,Produce magazine laugh teacher hot no work good home tell chair offer.,https://i.pravatar.cc/150?u=johnnewman37@example.com
dakotagonzales90@example.com,*&V9O1lol8TN,dakotagonzales90,Dakota,Gonzales,Cook Islands,Event either newspaper season house song mind him focus.,https://i.pravatar.cc/150?u=dakotagonzales90@example.com
anthonylawrence94@example.com,m#r@)4Olr!GX,anthonylawrence94,Anthony,Lawrence,Ireland,Truth over participant add full a voice table indeed special.,https://i.pravatar.cc/150?u=anthonylawrence94@example.com
sandrawalter58@example.com,V(0fzpPL9prW,sandrawalter58,Sandra,Walter,Zambia,Account less rather their make look likely set parent turn.,https://i.pravatar.cc/150?u=sandrawalter58@example.com
jeremyhansen57@example.com,XT4iihTdY!yi,jeremyhansen57,Jeremy,Hansen,Lao People's Democratic Republic,Know story conference left really light conference us.,https://i.pravatar.cc/150?u=jeremyhansen57@example.com
jameswashington48@example.com,_8WBzgtz24GZ,jameswashington48,James,Washington,Italy,First color involve son perform foreign else.,https://i.pravatar.cc/150?u=jameswashington48@example.com
lisamendoza75@example.com,$W2dHXAwh8G7,lisamendoza75,Lisa,Mendoza,Cyprus,Begin member significant position lead training despite figure report science boy.,https://i.pravatar.cc/150?u=lisamendoza75@example.com
christopherfowler18@example.com,8wV9&xGN9%1%,christopherfowler18,Christopher,Fowler,Kuwait,Bar stop number material executive follow deep store must hot certain.,https://i.pravatar.cc/150?u=christopherfowler18@example.com
joshuahopkins76@example.com,F4f$Xufg*Y7!,joshuahopkins76,Joshua,Hopkins,Mali,Each social itself class about matter nice second remain beautiful program maybe.,https://i.pravatar.cc/150?u=joshuahopkins76@example.com
johnperez55@example.com,3xG3MO))%(gH,johnperez55,John,Perez,Costa Rica,Step state wide draw because indeed let child party box.,https://i.pravatar.cc/150?u=johnperez55@example.com
cynthiabowen40@example.com,e1t3OlZ^Ti*L,cynthiabowen40,Cynthia,Bowen,Zambia,Care subject show long political discussion anyone peace building attention drop leader everybody.,https://i.pravatar.cc/150?u=cynthiabowen40@example.com
danapierce74@example.com,n(9IU2%xfIOX,danapierce74,Dana,Pierce,Turks and Caicos Islands,Ball such out affect create late pattern quickly eye safe court just skill add.,https://i.pravatar.cc/150?u=danapierce74@example.com
nicholasali48@example.com,&rCX9j+6u9_T,nicholasali48,Nicholas,Ali,Papua New Guinea,Shake practice source strategy seat box hope both never might act vote.,https://i.pravatar.cc/150?u=nicholasali48@example.com
evanreynolds94@example.com,&7ax2Ek!czNH,evanreynolds94,Evan,Reynolds,Gibraltar,Citizen field above front go already.,https://i.pravatar.cc/150?u=evanreynolds94@example.com
bethhill29@example.com,&6wupnjYNaS+,bethhill29,Beth,Hill,Spain,Continue young beat page population send behavior morning fear factor.,https://i.pravatar.cc/150?u=bethhill29@example.com
anthonysnyder65@example.com,r_26eEfL*)3+,anthonysnyder65,Anthony,Snyder,United States of America,Job suffer again sort move past lead not couple entire or.,https://i.pravatar.cc/150?u=anthonysnyder65@example.com
amandagrant12@example.com,@bhAVN&cc1$U,amandagrant12,Amanda,Grant,Ecuador,What experience hard there while expert cut wrong business season notice myself adult.,https://i.pravatar.cc/150?u=amandagrant12@example.com
dawnvalentine44@example.com,*yj+Pl!t63Vl,dawnvalentine44,Dawn,Valentine,United States Minor Outlying Islands,Size school major be respond power bit process cold pass box ball truth.,https://i.pravatar.cc/150?u=dawnvalentine44@example.com
heatherwillis49@example.com,#$aFS_vCff1*,heatherwillis49,Heather,Willis,Oman,Education news city skill as week bed put through explain.,https://i.pravatar.cc/150?u=heatherwillis49@example.com
lorettafletcher33@example.com,Ry9ZI!jjw+YE,lorettafletcher33,Loretta,Fletcher,Tanzania,Growth clearly minute society some paper story which.,https://i.pravatar.cc/150?u=lorettafletcher33@example.com
joethompson43@example.com,)9U5fWlr0muv,joethompson43,Joe,Thompson,Egypt,Make audience operation what together both turn.,https://i.pravatar.cc/150?u=joethompson43@example.com
garyware39@example.com,54FF@93r@#cc,garyware39,Gary,Ware,Saint Vincent and the Grenadines,Interview crime significant accept hit maintain.,https://i.pravatar.cc/150?u=garyware39@example.com
erinmartin22@example.com,84c#uTp_+eJf,erinmartin22,Erin,Martin,Cocos (Keeling) Islands,Pull sense off go mission small.,https://i.pravatar.cc/150?u=erinmartin22@example.com
sethhouston85@example.com,m4CkMZ!n#TGU,sethhouston85,Seth,Houston,Brazil,Environment effort focus board something there fill success reason likely.,https://i.pravatar.cc/150?u=sethhouston85@example.com
peteryates7@example.com,kbBLqsb$%8$x,peteryates7,Peter,Yates,Turkmenistan,Million half travel opportunity nothing practice discuss wear.,https://i.pravatar.cc/150?u=peteryates7@example.com
kathleenwilson15@example.com,QTK3!WMyW@dM,kathleenwilson15,Kathleen,Wilson,Turks and Caicos Islands,Deal per theory identify such east effort number court while administration.,https://i.pravatar.cc/150?u=kathleenwilson15@example.com
nicolewilliams97@example.com,gO6eWxgn8$yH,nicolewilliams97,Nicole,Williams,Seychelles,Social write already father nice mouth test guy long.,https://i.pravatar.cc/150?u=nicolewilliams97@example.com
brianmiller20@example.com,B1jX5HGD(FUZ,brianmiller20,Brian,Miller,Thailand,Character bank dinner total television see common.,https://i.pravatar.cc/150?u=brianmiller20@example.com
samantharose72@example.com,%eXbDiyfT0)T,samantharose72,Samantha,Rose,Zimbabwe,Send Democrat east usually decision effect surface thing never hot keep prepare.,https://i.pravatar.cc/150?u=samantharose72@example.com
katherinerobertson77@example.com,^4GaCTtKi+Rw,katherinerobertson77,Katherine,Robertson,Oman,Town development enter consider we yard be.,https://i.pravatar.cc/150?u=katherinerobertson77@example.com
