mail,password,username,first_name,last_name,country,description,profile_picture
jessemorris69@example.com,jnzaXa8o^Sv7,jessemorris69,Jesse,Morris,Togo,Authority them military others attention house join specific.,https://i.pravatar.cc/150?u=jessemorris69@example.com
tracyhunter14@example.com,y^6eq(3%+w#K,tracyhunter14,Tracy,Hunter,Sri Lanka,Where security final professor raise capital concern.,https://i.pravatar.cc/150?u=tracyhunter14@example.com
amylopez81@example.com,#(8e&Pd^3ut4,amylopez81,Amy,Lopez,Papua New Guinea,Reach authority water use door four draw discussion somebody inside value agency.,https://i.pravatar.cc/150?u=amylopez81@example.com
tammyroberson13@example.com,8$)wzA1R8rYk,tammyroberson13,Tammy,Roberson,Somalia,Back trade nice cold side field experience training.,https://i.pravatar.cc/150?u=tammyroberson13@example.com
bradleygordon77@example.com,V7%lJTW@(ZHt,bradleygordon77,Bradley,Gordon,Portugal,Animal change not charge anyone those second black accept.,https://i.pravatar.cc/150?u=bradleygordon77@example.com
lorilucas76@example.com,@1F#P(Nbk#B#,lorilucas76,Lori,Lucas,United States of America,Decade avoid student major themselves arm center hear security.,https://i.pravatar.cc/150?u=lorilucas76@example.com
jameslopez75@example.com,&xz3HDNdV*$*,jameslopez75,James,Lopez,Sweden,By standard leg month money free size Mr rest well among face total.,https://i.pravatar.cc/150?u=jameslopez75@example.com
derrickhowell41@example.com,61#_opynJ9tX,derrickhowell41,Derrick,Howell,Sri Lanka,Modern story show history article draw student win group.,https://i.pravatar.cc/150?u=derrickhowell41@example.com
williamkelley91@example.com,+2IuLy*fFAq_,williamkelley91,William,Kelley,Saint Kitts and Nevis,Own would night my former feel either thank position.,https://i.pravatar.cc/150?u=williamkelley91@example.com
sarahcharles53@example.com,Kqd1Vqli*YtJ,sarahcharles53,Sarah,Charles,Netherlands Antilles,Back image American head number structure.,https://i.pravatar.cc/150?u=sarahcharles53@example.com
davidromero83@example.com,6X)iQ^uHk49I,davidromero83,David,Romero,Colombia,Finish marriage finally change outside say face.,https://i.pravatar.cc/150?u=davidromero83@example.com
gregorypalmer83@example.com,gwh14Cf(d!&q,gregorypalmer83,Gregory,Palmer,France,Structure maybe impact will reality away me according.,https://i.pravatar.cc/150?u=gregorypalmer83@example.com
zacharysalas69@example.com,)zjIj)arW(0Z,zacharysalas69,Zachary,Salas,Liberia,Surface above power better key put organization they weight.,https://i.pravatar.cc/150?u=zacharysalas69@example.com
jasonharrell88@example.com,$5QYzDt+#GWE,jasonharrell88,Jason,Harrell,Cook Islands,Last main high wife affect type worker explain never prepare we beautiful late.,https://i.pravatar.cc/150?u=jasonharrell88@example.com
katelynthornton11@example.com,*(Lk2uMl_L5#,katelynthornton11,Katelyn,Thornton,Barbados,Issue may law window music conference wear section.,https://i.pravatar.cc/150?u=katelynthornton11@example.com
lawrenceroman62@example.com,+i^X!9JLgxc9,lawrenceroman62,Lawrence,Roman,Turkey,Thing would land whatever local concern work similar everybody.,https://i.pravatar.cc/150?u=lawrenceroman62@example.com
ethanharris54@example.com,#1NArk7J261W,ethanharris54,Ethan,Harris,Canada,Who himself measure resource help western grow drive different remain theory American message.,https://i.pravatar.cc/150?u=ethanharris54@example.com
angelarodgers10@example.com,(y8H%ms%ozeB,angelarodgers10,Angela,Rodgers,Vanuatu,Police live opportunity wonder program left.,https://i.pravatar.cc/150?u=angelarodgers10@example.com
parkermorales12@example.com,mGSwQfKL4m#o,parkermorales12,Parker,Morales,Barbados,Bad process machine east painting himself.,https://i.pravatar.cc/150?u=parkermorales12@example.com
madisoncollier83@example.com,$nQ8A$NvyYug,madisoncollier83,Madison,Collier,Vanuatu,Hospital pass popular certainly culture difficult.,https://i.pravatar.cc/150?u=madisoncollier83@example.com
williamvaughan60@example.com,)!()$&OgO*&1,williamvaughan60,William,Vaughan,Singapore,High kitchen worry mention moment seat performance for.,https://i.pravatar.cc/150?u=williamvaughan60@example.com
ashleewhitaker87@example.com,(%I_CUQhjM4u,ashleewhitaker87,Ashlee,Whitaker,Egypt,Thing without note culture finish gas color.,https://i.pravatar.cc/150?u=ashleewhitaker87@example.com
juliewoods76@example.com,l3PcOh%f#1HO,juliewoods76,Julie,Woods,Egypt,Poor low feeling behind sport appear experience artist wind speak feeling return.,https://i.pravatar.cc/150?u=juliewoods76@example.com
billyesparza76@example.com,VKWBvCa+^$2M,billyesparza76,Billy,Esparza,Eritrea,Challenge rich have upon check maybe.,https://i.pravatar.cc/150?u=billyesparza76@example.com
benjaminbanks52@example.com,Z^ka0SenO^4X,benjaminbanks52,Benjamin,Banks,Nicaragua,Nation own view next language part drug speak sound.,https://i.pravatar.cc/150?u=benjaminbanks52@example.com
brianwilliams64@example.com,eh8!Yxvg_i5Q,brianwilliams64,Brian,Williams,Mauritania,Race cover leave push image new century detail experience.,https://i.pravatar.cc/150?u=brianwilliams64@example.com
maryprice32@example.com,&@^n*WkQH)5w,maryprice32,Mary,Price,Algeria,Sometimes space various baby early drive sure bag.,https://i.pravatar.cc/150?u=maryprice32@example.com
annagardner86@example.com,I888PdlL(T2Q,annagardner86,Anna,Gardner,Czech Republic,Economic worry bank animal establish guy service defense yes.,https://i.pravatar.cc/150?u=annagardner86@example.com
louismiller35@example.com,^RbHXFpdM^8D,louismiller35,Louis,Miller,Denmark,Our night level political size home police evidence run resource.,https://i.pravatar.cc/150?u=louismiller35@example.com
alexandergilbert49@example.com,&M4VmvmK#$_F,alexandergilbert49,Alexander,Gilbert,Saudi Arabia,Trade every politics us place personal worry expert several religious executive.,https://i.pravatar.cc/150?u=alexandergilbert49@example.com
johncooper88@example.com,@4(UKlooTssD,johncooper88,John,Cooper,Maldives,Knowledge against take tell PM act floor enter human arm include.,https://i.pravatar.cc/150?u=johncooper88@example.com
karenjacobs87@example.com,^1^WJO*wHiem,karenjacobs87,Karen,Jacobs,Grenada,Care certain top adult on appear opportunity style second student arrive risk.,https://i.pravatar.cc/150?u=karenjacobs87@example.com
lauriemartinez76@example.com,zg*5zz^mvQ7I,lauriemartinez76,Laurie,Martinez,Lesotho,Thing draw order so receive prepare court.,https://i.pravatar.cc/150?u=lauriemartinez76@example.com
glennali86@example.com,$btMUWS&1(4A,glennali86,Glenn,Ali,Lesotho,Live detail town authority water health citizen agree foreign.,https://i.pravatar.cc/150?u=glennali86@example.com
mariacarr79@example.com,_5T0X$v5RB$D,mariacarr79,Maria,Carr,Lithuania,Population market risk season clearly key only.,https://i.pravatar.cc/150?u=mariacarr79@example.com
maureenrivera8@example.com,o*L(wMObDZl6,maureenrivera8,Maureen,Rivera,Burundi,Cost up minute cold data all research line choice.,https://i.pravatar.cc/150?u=maureenrivera8@example.com
kimberlypatterson50@example.com,L0Vr1Vn9QlJ_,kimberlypatterson50,Kimberly,Patterson,Cape Verde,Own arrive human want blue hospital skill peace.,https://i.pravatar.cc/150?u=kimberlypatterson50@example.com
alexandriagrant84@example.com,*kw$HRBG30zZ,alexandriagrant84,Alexandria,Grant,France,Forward not quickly book smile see least nature minute follow chance argue.,https://i.pravatar.cc/150?u=alexandriagrant84@example.com
kennethmurphy43@example.com,%2K^Qt++KqZ),kennethmurphy43,Kenneth,Murphy,Spain,Law who traditional them a film writer return specific support.,https://i.pravatar.cc/150?u=kennethmurphy43@example.com
johndudley63@example.com,@TY7N)Tb5o71,johndudley63,John,Dudley,China,Direction rich even in practice agreement blue table.,https://i.pravatar.cc/150?u=johndudley63@example.com
margaretbaker99@example.com,s095pKWi+)fx,margaretbaker99,Margaret,Baker,Japan,Alone create brother cost religious serious bill stage property prevent support.,https://i.pravatar.cc/150?u=margaretbaker99@example.com
amberarias71@example.com,M0i)7lDpao5r,amberarias71,Amber,Arias,Namibia,Tree pattern any might century paper some time on well inside prevent.,https://i.pravatar.cc/150?u=amberarias71@example.com
marypeterson88@example.com,z4Hp0cFqUlT*,marypeterson88,Mary,Peterson,Svalbard & Jan Mayen Islands,Whatever executive family ever class human single sister Republican this feel if.,https://i.pravatar.cc/150?u=marypeterson88@example.com
carmenbrown37@example.com,&sYFmT#M!7&^,carmenbrown37,Carmen,Brown,Gambia,Inside wife even sometimes bank suddenly subject just color.,https://i.pravatar.cc/150?u=carmenbrown37@example.com
carlakline26@example.com,8MNLoZym^9LD,carlakline26,Carla,Kline,Haiti,Agency like type peace word sport late company thus huge decision.,https://i.pravatar.cc/150?u=carlakline26@example.com
sandrarodriguez25@example.com,5g%mWWz!^Q+1,sandrarodriguez25,Sandra,Rodriguez,Bermuda,Film bad maintain while car return test laugh must.,https://i.pravatar.cc/150?u=sandrarodriguez25@example.com
gabrielthompson87@example.com,4+2_dbxn&EQa,gabrielthompson87,Gabriel,Thompson,Svalbard & Jan Mayen Islands,Marriage rise foot forward discuss college.,https://i.pravatar.cc/150?u=gabrielthompson87@example.com
marilyngarcia32@example.com,OH&MdOc^sew6,marilyngarcia32,Marilyn,Garcia,Bhutan,Economic them several continue with two behavior cut thus approach somebody help.,https://i.pravatar.cc/150?u=marilyngarcia32@example.com
charlesobrien21@example.com,6ZHhoOgj*xRG,charlesobrien21,Charles,Obrien,Palau,Then or knowledge foreign television gas young along already group certainly less least.,https://i.pravatar.cc/150?u=charlesobrien21@example.com
davidbaker3@example.com,T8Q@0Nt$^n^l,davidbaker3,David,Baker,Samoa,Thus yet along city charge truth bad office option.,https://i.pravatar.cc/150?u=davidbaker3@example.com
heathernolan32@example.com,(R2@RfU#_7S^,heathernolan32,Heather,Nolan,Sweden,Ball view behind school body contain pretty agreement think place responsibility mean amount.,https://i.pravatar.cc/150?u=heathernolan32@example.com
christopheraustin4@example.com,Z8PvPfgc&5@b,christopheraustin4,Christopher,Austin,Saint Martin,Side though plant allow peace chair radio travel least suggest fund author.,https://i.pravatar.cc/150?u=christopheraustin4@example.com
juliawatson64@example.com,iV%UKbXrP#Z4,juliawatson64,Julia,Watson,Serbia,Weight once instead attention determine few job conference art provide billion pick.,https://i.pravatar.cc/150?u=juliawatson64@example.com
amandaturner26@example.com,$R1d@RqqjZMY,amandaturner26,Amanda,Turner,Sierra Leone,Financial apply guy figure travel late choose deep my take.,https://i.pravatar.cc/150?u=amandaturner26@example.com
suzanneconrad32@example.com,i@FZ(swmyW9B,suzanneconrad32,Suzanne,Conrad,Antigua and Barbuda,Consumer catch four far similar item stuff moment Democrat community list call past.,https://i.pravatar.cc/150?u=suzanneconrad32@example.com
adrianrosales31@example.com,07mOh%SY%!mX,adrianrosales31,Adrian,Rosales,Cameroon,Mrs so response federal later great daughter.,https://i.pravatar.cc/150?u=adrianrosales31@example.com
zacharylewis99@example.com,m59Q_ncg&El9,zacharylewis99,Zachary,Lewis,Venezuela,Character soldier notice everything test perform attack eight lot marriage.,https://i.pravatar.cc/150?u=zacharylewis99@example.com
loridowns16@example.com,JBF0*$zxf!pj,loridowns16,Lori,Downs,United States of America,Report music tell protect after owner of everybody century animal.,https://i.pravatar.cc/150?u=loridowns16@example.com
michaeljacobs61@example.com,keEINJCzA)6@,michaeljacobs61,Michael,Jacobs,Northern Mariana Islands,Economic case sell talk main government imagine wife response.,https://i.pravatar.cc/150?u=michaeljacobs61@example.com
brianthomas45@example.com,RSEi*4p9!8UE,brianthomas45,Brian,Thomas,Bahamas,Green foot man conference despite per run heart expert.,https://i.pravatar.cc/150?u=brianthomas45@example.com
timothyhampton12@example.com,_XhduVkxMek4,timothyhampton12,Timothy,Hampton,Mayotte,Free their role whatever per may season close.,https://i.pravatar.cc/150?u=timothyhampton12@example.com
charlesgibson82@example.com,@OKEmWPgr0B6,charlesgibson82,Charles,Gibson,Cocos (Keeling) Islands,Audience office every across hard audience.,https://i.pravatar.cc/150?u=charlesgibson82@example.com
jenniferroy63@example.com,^QV%ASXcx9pN,jenniferroy63,Jennifer,Roy,Lesotho,Best food fish certain recognize factor teacher election fall mention southern professor.,https://i.pravatar.cc/150?u=jenniferroy63@example.com
alyssanavarro99@example.com,@F7nUoeQ9gV+,alyssanavarro99,Alyssa,Navarro,Mayotte,Capital doctor option professional so want worry necessary agent glass.,https://i.pravatar.cc/150?u=alyssanavarro99@example.com
jamesrios34@example.com,y(QSp3GZ96O*,jamesrios34,James,Rios,Uruguay,Realize garden administration add half risk capital ability beat receive pull artist day.,https://i.pravatar.cc/150?u=jamesrios34@example.com
markwalker98@example.com,B#0jNv3PUal3,markwalker98,Mark,Walker,Hungary,Else else southern begin might eight how down other factor perhaps.,https://i.pravatar.cc/150?u=markwalker98@example.com
lisasanchez32@example.com,FwLGV2Zh)^@r,lisasanchez32,Lisa,Sanchez,Gibraltar,Sort right itself name carry today community federal leg company both commercial team.,https://i.pravatar.cc/150?u=lisasanchez32@example.com
ernestthompson67@example.com,!7@x0RsXs98*,ernestthompson67,Ernest,Thompson,Guadeloupe,Performance today without hair perform move paper audience from end point.,https://i.pravatar.cc/150?u=ernestthompson67@example.com
crystalmcconnell81@example.com,+EesMLTp#0*b,crystalmcconnell81,Crystal,Mcconnell,Guatemala,Himself white house no recent magazine three others lot side what.,https://i.pravatar.cc/150?u=crystalmcconnell81@example.com
katherinejones85@example.com,c2vaKmU!MF#9,katherinejones85,Katherine,Jones,Papua New Guinea,Must last read computer hospital prevent poor size receive modern trip experience.,https://i.pravatar.cc/150?u=katherinejones85@example.com
nicolemoore36@example.com,L5QZ1PUM&^Ic,nicolemoore36,Nicole,Moore,Liberia,Management thank fire some management everything around.,https://i.pravatar.cc/150?u=nicolemoore36@example.com
ellensanders31@example.com,!C_BY_#urJ2x,ellensanders31,Ellen,Sanders,Afghanistan,Themselves be teacher yard on in bad.,https://i.pravatar.cc/150?u=ellensanders31@example.com
kimalvarado76@example.com,5Pnjc#n6L!y2,kimalvarado76,Kim,Alvarado,Azerbaijan,Media change certainly reduce other where option itself star drop.,https://i.pravatar.cc/150?u=kimalvarado76@example.com
susancox51@example.com,SnSz&e!z@8ED,susancox51,Susan,Cox,Lao People's Democratic Republic,Somebody allow feel particular become degree mind degree.,https://i.pravatar.cc/150?u=susancox51@example.com
stevenho58@example.com,&60HNBztxW+5,stevenho58,Steven,Ho,Norway,Will who themselves wall building trouble bring most score current.,https://i.pravatar.cc/150?u=stevenho58@example.com
patriciaflores51@example.com,_4pf6OjC%nIQ,patriciaflores51,Patricia,Flores,Liberia,With story court know glass get understand new call hit discover beat.,https://i.pravatar.cc/150?u=patriciaflores51@example.com
terrilopez58@example.com,%Z6XRzrhX&6M,terrilopez58,Terri,Lopez,Senegal,Eye husband water happen language truth maintain.,https://i.pravatar.cc/150?u=terrilopez58@example.com
lucasscott94@example.com,^8Ywo27xaMXV,lucasscott94,Lucas,Scott,Saint Vincent and the Grenadines,Majority our night ability discuss brother heavy bag material him.,https://i.pravatar.cc/150?u=lucasscott94@example.com
johnyoung80@example.com,G^3F6MrCM^jw,johnyoung80,John,Young,Indonesia,Figure ago security win director side customer energy turn any camera family away.,https://i.pravatar.cc/150?u=johnyoung80@example.com
christinealvarado38@example.com,HIXqN9Ls(Z5+,christinealvarado38,Christine,Alvarado,Guernsey,Local school middle policy computer half sing hit else star their land week certainly.,https://i.pravatar.cc/150?u=christinealvarado38@example.com
raymondharper21@example.com,M!25IP6nONtp,raymondharper21,Raymond,Harper,Solomon Islands,Practice finish want group good or explain together into.,https://i.pravatar.cc/150?u=raymondharper21@example.com
terrismith72@example.com,RnoQPsKS*r8y,terrismith72,Terri,Smith,Libyan Arab Jamahiriya,Owner benefit ten movement behind floor list card vote guy action answer find water.,https://i.pravatar.cc/150?u=terrismith72@example.com
christinegoodman39@example.com,(ws9EJChe1Ua,christinegoodman39,Christine,Goodman,Mauritius,Create together word goal full network test consider.,https://i.pravatar.cc/150?u=christinegoodman39@example.com
erinmendoza13@example.com,(k%IDLgB_s%4,erinmendoza13,Erin,Mendoza,Lebanon,Interview option staff garden family provide democratic up little important test box kind.,https://i.pravatar.cc/150?u=erinmendoza13@example.com
matthewlane20@example.com,AN0GUmfbD_5n,matthewlane20,Matthew,Lane,Norfolk Island,Improve could statement poor on need house several.,https://i.pravatar.cc/150?u=matthewlane20@example.com
jamesyoung88@example.com,)lQ^Qctg6ZHB,jamesyoung88,James,Young,Bosnia and Herzegovina,Growth wonder government health thus economy cell return something support.,https://i.pravatar.cc/150?u=jamesyoung88@example.com
meganrobertson20@example.com,(NqV6Sex69&U,meganrobertson20,Megan,Robertson,Greenland,Blue thing sometimes resource manager every figure life candidate.,https://i.pravatar.cc/150?u=meganrobertson20@example.com
jonathanhawkins50@example.com,o56Hll^TThR#,jonathanhawkins50,Jonathan,Hawkins,Poland,Structure top organization parent three start myself today understand.,https://i.pravatar.cc/150?u=jonathanhawkins50@example.com
eileenbaker13@example.com,^csqPrz$4*36,eileenbaker13,Eileen,Baker,Niue,Watch three play decision of popular head wish develop north individual population.,https://i.pravatar.cc/150?u=eileenbaker13@example.com
melissahall87@example.com,03F^8$bG!@!u,melissahall87,Melissa,Hall,Algeria,Success allow while when drug thought.,https://i.pravatar.cc/150?u=melissahall87@example.com
anthonygarcia48@example.com,@IUBc!3rrR2m,anthonygarcia48,Anthony,Garcia,Gambia,Traditional film always something Democrat issue campaign relationship.,https://i.pravatar.cc/150?u=anthonygarcia48@example.com
annrobinson40@example.com,@9adSsW8$THt,annrobinson40,Ann,Robinson,New Zealand,Pick item officer bad hot however fact technology network speech upon.,https://i.pravatar.cc/150?u=annrobinson40@example.com
haleygreen74@example.com,Q0jTEAfK^I6#,haleygreen74,Haley,Green,Kuwait,Nation about federal senior purpose do condition pick.,https://i.pravatar.cc/150?u=haleygreen74@example.com
emilychristensen57@example.com,)v9&94%+(9EI,emilychristensen57,Emily,Christensen,Japan,Scene election to trade use under top of herself project various.,https://i.pravatar.cc/150?u=emilychristensen57@example.com
isaacmurphy25@example.com,upXm+CUxy+T9,isaacmurphy25,Isaac,Murphy,Swaziland,Reason former major talk book brother next throughout ground peace.,https://i.pravatar.cc/150?u=isaacmurphy25@example.com
kristabarker95@example.com,!+*EGZIhR6zg,kristabarker95,Krista,Barker,Kazakhstan,Impact public itself any instead reach back brother able law affect.,https://i.pravatar.cc/150?u=kristabarker95@example.com
christopheracosta82@example.com,6sce3bIz7*0q,christopheracosta82,Christopher,Acosta,Malawi,Theory level assume quickly official best week character health foot guy.,https://i.pravatar.cc/150?u=christopheracosta82@example.com
rubendavis90@example.com,f(6Lr9wDD*M_,rubendavis90,Ruben,Davis,Estonia,Stage staff early wish power future deep experience.,https://i.pravatar.cc/150?u=rubendavis90@example.com
ryanthomas55@example.com,7q0!btzfn+GQ,ryanthomas55,Ryan,Thomas,Montserrat,Again any step peace couple success evening budget need.,https://i.pravatar.cc/150?u=ryanthomas55@example.com
markhall52@example.com,dqF2BGZe!nnh,markhall52,Mark,Hall,Ghana,Feel out however left increase open travel leg more five trade act why.,https://i.pravatar.cc/150?u=markhall52@example.com
nancywilliams3@example.com,ZYdGy8ER@9Sg,nancywilliams3,Nancy,Williams,Canada,Discover sound policy market church check near Democrat instead finish dream figure difference.,https://i.pravatar.cc/150?u=nancywilliams3@example.com
andreajames81@example.com,FymX3pGj+^tw,andreajames81,Andrea,James,Malaysia,Position major prepare bill keep design natural quickly middle generation tough both however.,https://i.pravatar.cc/150?u=andreajames81@example.com
carrietrujillo33@example.com,@&GJ@XBh79E7,carrietrujillo33,Carrie,Trujillo,Cayman Islands,Modern idea win economy against same black everything what.,https://i.pravatar.cc/150?u=carrietrujillo33@example.com
ronaldrobertson93@example.com,(^1%M9qTPgvY,ronaldrobertson93,Ronald,Robertson,Samoa,Debate data offer training former concern method even develop keep million.,https://i.pravatar.cc/150?u=ronaldrobertson93@example.com
michaelbradshaw60@example.com,A7P*Sl7Xi^8u,michaelbradshaw60,Michael,Bradshaw,Guernsey,Into operation politics stay explain tend.,https://i.pravatar.cc/150?u=michaelbradshaw60@example.com
alejandrocarroll99@example.com,mHZ&OZyd@6R4,alejandrocarroll99,Alejandro,Carroll,Cape Verde,Appear letter while off than Republican dog we name as.,https://i.pravatar.cc/150?u=alejandrocarroll99@example.com
calebburns94@example.com,K!j6DmrjVBc(,calebburns94,Caleb,Burns,Guam,Model figure lead life someone not authority certain keep star know.,https://i.pravatar.cc/150?u=calebburns94@example.com
alisharoberts15@example.com,$az*dJqB38gk,alisharoberts15,Alisha,Roberts,Chile,Foreign four person with rate agree science series memory.,https://i.pravatar.cc/150?u=alisharoberts15@example.com
johnarmstrong22@example.com,_L1sE*rxSXo2,johnarmstrong22,John,Armstrong,Central African Republic,International detail land determine not issue laugh south control past then yet often.,https://i.pravatar.cc/150?u=johnarmstrong22@example.com
jennifersanchez57@example.com,)FHVpJvj%37e,jennifersanchez57,Jennifer,Sanchez,New Caledonia,Next number usually clearly approach share research civil carry road suggest girl consider.,https://i.pravatar.cc/150?u=jennifersanchez57@example.com
andrewnelson78@example.com,Bp@8lXhu4%9D,andrewnelson78,Andrew,Nelson,United Kingdom,Case instead leader when later hit possible learn service Mrs.,https://i.pravatar.cc/150?u=andrewnelson78@example.com
angeladaniel76@example.com,^7x+K#oinFu0,angeladaniel76,Angela,Daniel,Luxembourg,Office may next big record not bad federal one now argue.,https://i.pravatar.cc/150?u=angeladaniel76@example.com
normagarcia67@example.com,(5O6xHRpPj*U,normagarcia67,Norma,Garcia,Zambia,Church summer similar measure me happy heavy society step threat since child language.,https://i.pravatar.cc/150?u=normagarcia67@example.com
stephaniehernandez45@example.com,@F7SXzYE*_mn,stephaniehernandez45,Stephanie,Hernandez,Costa Rica,Rate cause floor interest source fight.,https://i.pravatar.cc/150?u=stephaniehernandez45@example.com
donnamartin27@example.com,+o17DOMkTlRq,donnamartin27,Donna,Martin,Namibia,Left project body after agree culture woman use.,https://i.pravatar.cc/150?u=donnamartin27@example.com
shirleywillis79@example.com,%8@RKxVfkgg8,shirleywillis79,Shirley,Willis,Philippines,Politics speak skill lead something effort heart my sell wrong individual.,https://i.pravatar.cc/150?u=shirleywillis79@example.com
stephanieknox21@example.com,_oJa8ZKno4tr,stephanieknox21,Stephanie,Knox,Seychelles,Because against drive big perform exist detail simple other.,https://i.pravatar.cc/150?u=stephanieknox21@example.com
markfrancis93@example.com,#UYeU$H_x7Z&,markfrancis93,Mark,Francis,Burundi,Where course daughter large fill people community subject.,https://i.pravatar.cc/150?u=markfrancis93@example.com
joshuacummings55@example.com,+CpuRZsz7*Cn,joshuacummings55,Joshua,Cummings,Ukraine,Serve according those resource left stage else wrong after line these ask billion.,https://i.pravatar.cc/150?u=joshuacummings55@example.com
angelalopez58@example.com,rPFPrTlz*j2A,angelalopez58,Angela,Lopez,Grenada,Guy never feeling others discussion police system involve memory according common military me.,https://i.pravatar.cc/150?u=angelalopez58@example.com
justingardner14@example.com,_sWCQ5dp&7#k,justingardner14,Justin,Gardner,Luxembourg,Though doctor argue by commercial it those design nor service.,https://i.pravatar.cc/150?u=justingardner14@example.com
pamelathompson32@example.com,S&8OHvzcSM+4,pamelathompson32,Pamela,Thompson,Timor-Leste,Tv leg somebody husband realize site citizen lay.,https://i.pravatar.cc/150?u=pamelathompson32@example.com
benjaminshah14@example.com,NjGZFbZk!c0L,benjaminshah14,Benjamin,Shah,Qatar,Source generation range different plant analysis throughout improve power particular eat.,https://i.pravatar.cc/150?u=benjaminshah14@example.com
brianking95@example.com,F1TDBwof%%iN,brianking95,Brian,King,Gabon,Director human artist degree accept enough next attack window upon stuff.,https://i.pravatar.cc/150?u=brianking95@example.com
richardtanner89@example.com,mlNt1AQ$+N2o,richardtanner89,Richard,Tanner,Lao People's Democratic Republic,Necessary contain commercial part senior executive star cultural citizen away.,https://i.pravatar.cc/150?u=richardtanner89@example.com
mariewhite80@example.com,6vkKUauy$qD),mariewhite80,Marie,White,Cayman Islands,Day next hand expect action toward piece dog probably data organization pull.,https://i.pravatar.cc/150?u=mariewhite80@example.com
robertbrown60@example.com,4@c9zVf3Nlc6,robertbrown60,Robert,Brown,Finland,Event feeling parent number budget management mouth challenge begin week poor pretty white.,https://i.pravatar.cc/150?u=robertbrown60@example.com
