mail,password,username,first_name,last_name,country,description,profile_picture
nancywagner95@example.com,BQr!9+k(#9(m,nancywagner95,Nancy,Wagner,Central African Republic,Process state paper keep traditional PM next evidence house report.,https://i.pravatar.cc/150?u=nancywagner95@example.com
jillhenson12@example.com,z!@_I3qqyx3z,jillhenson12,Jill,Henson,Western Sahara,System maintain year state member market.,https://i.pravatar.cc/150?u=jillhenson12@example.com
laurastephens10@example.com,qWO88XNut^mv,laurastephens10,Laura,Stephens,Netherlands,Such tough require visit affect data.,https://i.pravatar.cc/150?u=laurastephens10@example.com
vanessaho95@example.com,+C(fsya+28tF,vanessaho95,Vanessa,Ho,Singapore,Green responsibility billion city step career many.,https://i.pravatar.cc/150?u=vanessaho95@example.com
crystalgallagher85@example.com,X*X0FdH3yQ$r,crystalgallagher85,Crystal,Gallagher,Papua New Guinea,Moment reduce six court major international it over dog doctor.,https://i.pravatar.cc/150?u=crystalgallagher85@example.com
dawnerickson5@example.com,A^0&gQoUtz$1,dawnerickson5,Dawn,Erickson,Ireland,Western training owner second dinner lose make within change fire win.,https://i.pravatar.cc/150?u=dawnerickson5@example.com
barbarajohnson1@example.com,wr295YiX!*TI,barbarajohnson1,Barbara,Johnson,Montenegro,Put stand development doctor reason strong create particular everything much debate none.,https://i.pravatar.cc/150?u=barbarajohnson1@example.com
johnvasquez34@example.com,%4wNERe5ia9G,johnvasquez34,John,Vasquez,Saint Martin,Project ability son would true realize large political.,https://i.pravatar.cc/150?u=johnvasquez34@example.com
ianmorrison70@example.com,e#(J1Nu0ixDu,ianmorrison70,Ian,Morrison,Libyan Arab Jamahiriya,Letter fight mention reality four expect economic bank keep again opportunity.,https://i.pravatar.cc/150?u=ianmorrison70@example.com
deborahjones15@example.com,EGOgi6ry&b2Y,deborahjones15,Deborah,Jones,Egypt,Seek Mr actually politics us third team turn car.,https://i.pravatar.cc/150?u=deborahjones15@example.com
anthonyrichardson41@example.com,D)oRniTLe50X,anthonyrichardson41,Anthony,Richardson,Oman,Key lay feeling turn door head.,https://i.pravatar.cc/150?u=anthonyrichardson41@example.com
courtneyclements21@example.com,g$f7rA@1koI0,courtneyclements21,Courtney,Clements,Lesotho,Success history type me continue company mean nature range prepare listen cover born.,https://i.pravatar.cc/150?u=courtneyclements21@example.com
sergiojoseph56@example.com,d9LeO$PK%w4C,sergiojoseph56,Sergio,Joseph,Monaco,Partner like throw behavior course notice wind air middle.,https://i.pravatar.cc/150?u=sergiojoseph56@example.com
wesleyriley6@example.com,Q2qNQnE#^0us,wesleyriley6,Wesley,Riley,Mali,Wait unit movement call more personal executive tend result stand article.,https://i.pravatar.cc/150?u=wesleyriley6@example.com
susanleon99@example.com,HnEyChrI@c4Z,susanleon99,Susan,Leon,Cote d'Ivoire,Less three soon information media key ready catch city effect.,https://i.pravatar.cc/150?u=susanleon99@example.com
michaelroach26@example.com,^!oeWCTucg1!,michaelroach26,Michael,Roach,Kenya,Believe light four play item safe.,https://i.pravatar.cc/150?u=michaelroach26@example.com
matthewmcdowell41@example.com,*$K_5SmX^M6D,matthewmcdowell41,Matthew,Mcdowell,Jordan,Key south try white page subject each individual major both enter fast hear.,https://i.pravatar.cc/150?u=matthewmcdowell41@example.com
dannyandrade7@example.com,L%)MRv9a0Y1i,dannyandrade7,Danny,Andrade,Libyan Arab Jamahiriya,Determine letter ever I among all stage attorney after lawyer.,https://i.pravatar.cc/150?u=dannyandrade7@example.com
harrywoods39@example.com,8xlT@#I_!gOa,harrywoods39,Harry,Woods,British Indian Ocean Territory (Chagos Archipelago),That it music employee also election company hear environmental whose candidate anything cell.,https://i.pravatar.cc/150?u=harrywoods39@example.com
sarahhansen62@example.com,WX6JZWx+J)#K,sarahhansen62,Sarah,Hansen,Anguilla,Usually actually investment common hope still sit reach.,https://i.pravatar.cc/150?u=sarahhansen62@example.com
jeffreyedwards6@example.com,mmpI2pa%_3F6,jeffreyedwards6,Jeffrey,Edwards,Belgium,Positive page success medical unit enjoy.,https://i.pravatar.cc/150?u=jeffreyedwards6@example.com
aimeegraham39@example.com,$GcLdZ#haz7K,aimeegraham39,Aimee,Graham,Cocos (Keeling) Islands,Second control itself station type ball.,https://i.pravatar.cc/150?u=aimeegraham39@example.com
markknight29@example.com,&0UtMaty%%0X,markknight29,Mark,Knight,Japan,Window stage past choice cost though my throw lay may.,https://i.pravatar.cc/150?u=markknight29@example.com
shawnanderson80@example.com,h!X^_LIw3f9#,shawnanderson80,Shawn,Anderson,Kazakhstan,Cause one defense around team safe west loss find produce decision water.,https://i.pravatar.cc/150?u=shawnanderson80@example.com
nancyriggs69@example.com,x_9pVa4qlbFI,nancyriggs69,Nancy,Riggs,Tuvalu,Occur yes join serious most television.,https://i.pravatar.cc/150?u=nancyriggs69@example.com
marksimon96@example.com,6qxKVBSi+11u,marksimon96,Mark,Simon,Czech Republic,Organization would about however assume him over past last feel team.,https://i.pravatar.cc/150?u=marksimon96@example.com
kathrynbailey45@example.com,jsh5^Vp!@1RE,kathrynbailey45,Kathryn,Bailey,Guinea-Bissau,Budget across several thousand during operation almost no career hot rather yes sometimes.,https://i.pravatar.cc/150?u=kathrynbailey45@example.com
cynthiapowers48@example.com,1Ivawxp_#LVM,cynthiapowers48,Cynthia,Powers,Ecuador,Nor out hold be report practice.,https://i.pravatar.cc/150?u=cynthiapowers48@example.com
kaitlinrobertson39@example.com,@x0xEm56CaYJ,kaitlinrobertson39,Kaitlin,Robertson,Djibouti,Anything need operation international town start government current.,https://i.pravatar.cc/150?u=kaitlinrobertson39@example.com
patrickestrada33@example.com,#SJ$JeSCe(6D,patrickestrada33,Patrick,Estrada,Dominican Republic,Must design under medical news safe.,https://i.pravatar.cc/150?u=patrickestrada33@example.com
davidkeith54@example.com,v$5Elv$yIfXn,davidkeith54,David,Keith,Myanmar,Writer tax soon true feeling huge allow style more exist alone goal town.,https://i.pravatar.cc/150?u=davidkeith54@example.com
anthonygarcia60@example.com,c@1C&JLy1ZN^,anthonygarcia60,Anthony,Garcia,Cambodia,Decade say successful though especially join song exist her carry business after whose.,https://i.pravatar.cc/150?u=anthonygarcia60@example.com
alexanderjones50@example.com,WLAZ3Wpkft!$,alexanderjones50,Alexander,Jones,Central African Republic,Not customer who him practice film technology book phone possible floor consider.,https://i.pravatar.cc/150?u=alexanderjones50@example.com
christinebell65@example.com,SeByZ#RJh4w^,christinebell65,Christine,Bell,Uruguay,Because economic increase eight per above my.,https://i.pravatar.cc/150?u=christinebell65@example.com
lukemitchell66@example.com,sYGaw_uv_7S&,lukemitchell66,Luke,Mitchell,Aruba,Second hard their performance agency nothing fund daughter.,https://i.pravatar.cc/150?u=lukemitchell66@example.com
edwardpage48@example.com,)9GrdAJ89$y8,edwardpage48,Edward,Page,Niger,Law north attention create word young each television fact.,https://i.pravatar.cc/150?u=edwardpage48@example.com
marydavenport10@example.com,*rHxADdrRyD1,marydavenport10,Mary,Davenport,Guyana,Several nothing stage but impact PM half interesting particular industry statement.,https://i.pravatar.cc/150?u=marydavenport10@example.com
chadanderson46@example.com,b4MwSOoo*Rlf,chadanderson46,Chad,Anderson,Antigua and Barbuda,Sort few bit out environment everything.,https://i.pravatar.cc/150?u=chadanderson46@example.com
robinsanford40@example.com,S^wb3CEyyy&!,robinsanford40,Robin,Sanford,Barbados,Truth father report within system chance as southern than morning go.,https://i.pravatar.cc/150?u=robinsanford40@example.com
lindseylopez88@example.com,%314Ut90_v!7,lindseylopez88,Lindsey,Lopez,Panama,Recently such war news might east others require.,https://i.pravatar.cc/150?u=lindseylopez88@example.com
abigailharris61@example.com,JH0YqF%a(aX0,abigailharris61,Abigail,Harris,Kenya,Little network mind under top decision would now person.,https://i.pravatar.cc/150?u=abigailharris61@example.com
catherinecarter75@example.com,R)^_iCq9&*9b,catherinecarter75,Catherine,Carter,Vanuatu,Example group technology remember image assume television.,https://i.pravatar.cc/150?u=catherinecarter75@example.com
danavery43@example.com,s_0RjyCzBK$),danavery43,Dan,Avery,Tonga,Main song gas kind force treat boy development career size.,https://i.pravatar.cc/150?u=danavery43@example.com
susanpatel20@example.com,0HVdxK(k+_1v,susanpatel20,Susan,Patel,Kuwait,More weight approach employee class rate history program term responsibility respond.,https://i.pravatar.cc/150?u=susanpatel20@example.com
